{
  "schema_version": 1,
  "level_id": "two_echo_convergence",
  "title": "Two Echo Convergence",
  "terrain_rows": [
    "#########",
    "#.....#.#",
    "#.......#",
    "#.......#",
    "#.#...#.#",
    "#.......#",
    "#########"
  ],
  "player_spawn": [1, 5],
  "echoes": [
    {"id": "echo_near", "delay": 2, "spawn": [1, 5]},
    {"id": "echo_late", "delay": 4, "spawn": [1, 5]}
  ],
  "plates": [
    {"id": "plate_a", "position": [6, 3]},
    {"id": "plate_b", "position": [7, 5]}
  ],
  "doors": [
    {"id": "door_convergence", "position": [7, 2], "initial_open": false, "all_plate_ids": ["plate_a", "plate_b"]}
  ],
  "exit": {"position": [7, 1]},
  "metadata": {
    "teaching_goal": "Converge the delay-2 and delay-4 ECHOs on separate Plates, then cross the A+B Door on its open snapshot.",
    "intended_mechanics": ["delayed_echo", "two_echo_convergence", "two_plate_and", "next_turn_door"],
    "notes": "Task 0015 Level 7. A compact three-cycle recovery topology feeds one unavoidable convergence Door.",
    "allow_zero_echo_tutorial": false
  },
  "validation": {"recommended_search_depth": 64}
}
